"","X","Name","Date","Source","Text"
"1790",1790,"Anderson Cooper 360","August 24, 2022","Comcast Cable","the government, and capture kyiv in a matter of days. his 24th and february innovation officially to free the country from nazis and stop it from joining nato, met ferocious ukrainian resistance from day one. assault convoys to the capitol were stalled and attacked. russian troops driven back from kyiv, fell upon citizens in irpin and bucha. their atrocities, revealed as they were forced out, leaving misery and murder in their wake. soon, russians turned their guns on civilians across the country. as the kremlin's tactics switched from replacing ukraine 's rulers to breaking its people. railway stations, residential blocks, hospitals, even a"
"1791",1791,"Anderson Cooper 360","August 24, 2022","Comcast Cable",">> you mentioned last night special election night in new york's 19th district, which is a district that biden won by a point and a half. all the sudden, you see the democrat there pat ryan winning by two points. it is not the only special election last night. there's also a special election"
"1795",1795,"Anderson Cooper 360","March 23, 2022","","felt they didn't have a chance. one of the things he said they had seen with the training they got with the americans really helps them. they say what they do now is they don't just fly to try to go up and get the russians. they analyze everything. they come up with a strategy. they don't get pulled into moves. they doll feel more and more sure. however, of course, one of the things we have to point out, the russians have a lot more planes, a lot more modern planes. and there is big attrition among the ukrainian air force as well. while they hold up now, they say it's not something that's going to go on forever unless of course they get some kind of help. we've been talking about, the u.s. has been talking about a no fly zone is not something in the cards. the biden administration has pointed that out. but the ukrainians have said"
"1796",1796,"Anderson Cooper 360","April 28, 2022","Comcast Cable","at any time without the unnecessary fees. we'll help you go from saving... to living. ♪ play all day ♪   over the last two months we've gotten to know a mom here in kyiv named olena gnes. we've spoken many times over satellite, as they've been living, for the most part, in a basement shelter, while their father, sergey, fights the war. oli na has been documenting what life has been like from them. we've learned so much from her and her family at a distance over an internet connection. today for the first time i got to meet her and her kids face to face. here's more of our conversation. so, for now you spend days here but at night you go back to the basement. >> yeah, exactly. yes. yes."
"1818",1818,"Anderson Cooper 360","October 24, 2022","Comcast Cable","tonight. there's new cnn polling of likely voting in two key senate races in wisconsin and pennsylvania. wisconsin showing no clear leader in the showdown between incumbent republican ron johnson and democrat mandela barnes. pennsylvania with document lieutenant governor fetterman narrowly ahead of mehmet oz. we learned late today that former president obama will be campaigning there along with president biden on the final weekend before election day. a party official familiar with the planning telling cnn they've got appearances scheduled for pittsburgh and philadelphia with the possibility of adding more. early voting is under way there and in 38 other states. so far turnout has been heavy on pace with the record 2018 midterms with nearly 7.3 million ballots already cast. with it, we've already seen multiple reports of voter intimidation, including two armed men dressed in tactical gear sported at a ballot drop box in mesa, arizona, friday night. attorney general merrick garland was asked about it this"
"1834",1834,"Anderson Cooper 360","March 3, 2022","Comcast Cable","where to shove it, echo here. >> [ bleep ]. >> russian ship [ bleep ] you. it's the logo now in ukraine. >> reporter: they'll need more than high spirits in the days ahead. >> nick paton walsh joins us now from odesa. i mean, that mom, you know, it's just -- i mean, listening to her, you know, she's -- she just wants to protect her kids and yet she's proud of them of course for fighting. and she's, you know, telling putin where to go. i mean, it's just extraordinary. there are so many moms like that. you know, we see them here in lviv. we see them in kyiv. we see them everywhere. and probably there are moms like that in russia who are sick that their sons are in that convoy or foot soldiers in this war that, you know, they don't even want."
"1854",1854,"Anderson Cooper 360","March 25, 2022","Comcast Cable","weapons. and even for training, the ones i was with, you know, some of the -- like a local gun collector had given them a bunch of old weapons to just train with. they were using -- one of them had a tommy gun from the 1930s. what were the kind of supplies that your folks have? >> you know, so, we were more southwest, and all these weapons appeared to be issued. they were all newer condition, all the same ak-47s or ak-74s or aks. in that same vein of what you said, they want to practice with something. some had weapons. they had their hands up and bang bang. but one particular member brought a air soft gun, and we told him, hey, this is not a game. don't bring a toy. we're bringing for real. there's russians in your country right now. >> it's -- it's -- you know, it's always fascinating when -- and i think important when --"
"1903",1903,"Anderson Cooper 360","January 26, 2022","Comcast Cable","also a look at hearings that have left an indelible mark on history and perhaps the court as well. >> from my standpoint, as a black american, as far as i'm concerned, it is a high-tech lynching for uppity blacks who in any way dane to think for themselves. >> later, senator chris murphy who traveled to ukraine, on where things stand now as the administration delivered its written reply to russia's demands. like what if i give you a lollipop... then i give you our best lollipop. that's not fair. at at&t we think it's only fair that all customers get our best deals... ...and you get a choice of plans. she said everyone? it's not complicated. only at&t gives both new & existing customers our same best deals, like up to $800 off our most popular smartphones. new vicks convenience pack. dayquil severe for you... and daily vicks super c for me. vicks super c is a daily supplement with vitamin c and b"
"1905",1905,"Anderson Cooper 360","March 24, 2022","Comcast Cable","believes taking the capitol of kyiv remains russia's main goal, but the city's mayor, former world champ vows putin's troops will not enter this town. we met the mayor and his brother vladimir in a secret location in kyiv. >> do you think you have what it takes to fend them off completely and that this city will not be taken by russia? >> it's our hometown. we will -- we don't want to be slaves. we don't want ussr to live in our territory. we see it as modern. democratic. >> the klitschkos are on the move constantly. putin says he's only targeting"
"1918",1918,"Anderson Cooper 360","September 27, 2022","Comcast Cable","braced for the hurricane to make landfall. now expected the first forecast, and further south. in some parts, ian is already being felt. the situation will deteriorate throughout the night. authorities are warning that some areas will see more than two feet of rain. right now, more than two and a half million people are under some form of evacuation warning. and as of this hour, officials warn that time is fast running out to leave. >> you still have time to do. it you do not have to evacuate hundreds of miles. obviously if you have friends, family, some of, that that's preferable. but as a last resort, the shelters are open. and i would just urge people to take advantage of that. it's, i know it's not easy sometimes to leave your home. and i know that people want to not want to see something bad happened when they get. back but stakes are high. this is a very powerful storm. >> cnn meteorologist pedram javaheri is tracking the storm. with us but let's start with their van dam in clearwater, florida. derek, where and when it will"
"1922",1922,"Anderson Cooper 360","October 10, 2022","Comcast Cable","against this officer. it's quite a turn because initially 17 year old eric was charged with evading arrest and assaulting a police officer. those charges against the teenager have since been dropped. ed lavandera, thank, you we appreciate it. coming up, russia launches its heaviest airstrikes today since it started the war. elief with more concentrated power. because the only thing dripping should be your style! plop plop fizz fizz, winter warriors with alka-seltzer plus. this is going to be great. taking the shawl off. i did it. is he looking at my hairline? my joint pain isn't too bad. well, it wasn't this morning. i hope i can get through this. is plaque psoriasis or psoriatic arthritis making you rethink your everyday choices? otezla is a pill, not a cream or injection that can help people with plaque psoriasis achieve clearer skin. otezla is proven to reduce joint swelling,"
"1947",1947,"Anderson Cooper 360","April 26, 2022","Comcast Cable","there. anina was three when the last war ended but doesn't know when this one will. hour by hour, everything changes. things are moving fast enough here that just 24 hours are going, a village just 24 kilometers in that direction was the meeting point in which people evacuated, now seems to be under fire and just see panicked locals rushing in to collect their relatives. distant treelines are packed with troops, the blue horizon sometimes marked by smoke. a rumble of rockets still here and you see the damage of what they've done before, but somewhere like this has felt, to some degree, it didn't survive the worst of the war but now in the second phase of the russian operation, the brutality of those forces is essentially coming straight their way. the flag flies still in a spot here where lennin used to stand and needs an army to hold it in"
"1954",1954,"Anderson Cooper 360","February 21, 2022","Comcast Cable","sanctions. we could do this on our own and that doesn't take the europeans. it would be good if the europeans join us but this needs to happen now. we have that exactly what we're going to do and we made it clear that the trigger was a soldier, or a tank or an airplane or mals going across that border. and that's what is happening. that's exactly what is happening. so i think the united states has to take that step. and i'm hoping the europeans will join us. >> we'll see what happens the next few hours and tomorrow morning when the white house has a chance to reassess. steve, the speech from vladimir putin, a sense of denialism, a sense of denying the actual independent history of ukraine. anilistic in many ways. and i think that putin has used this time of language before. in such a key moment with the world watching, why do you think he did it with the impact? >> well, first, let me strongly"
"1956",1956,"Anderson Cooper 360","February 21, 2022","Comcast Cable","despite the propaganda that putin uses, calling it peacekeeping. even more ominous, what he had to say in a lengthy and combative speech. his remarks began with a twisted history lesson, distorted to russia's point of view. he ended with a threat to all of ukraine. in fact, a sort of denial that ukraine even exists. >> translator: i would like to reiterate that ukraine is not our neighboring country. it is an integral part of our own history, culture, and spiritual space. ukraine from the beginning, and in its totality has been created by russia. those who have taken the power and are holding the power in ukraine. we demand, stop any of the military actions. otherwise, the responsibility will be on the governing --"
"1987",1987,"Anderson Cooper 360","February 24, 2022","Comcast Cable","little strategic military value to the russian government but one thing they noted is that it does provide a direct route to kyiv from territory that is russian controlled so if that plays into the factor of what russia is doing and and their game plan is now. >> kaitlan collins, thank you so much. senior fellow at harvard's belfort centers. also, cnn national security analyst and former cia chief of russia operations, steve hall. as russians reportedly advance on kyiv and given the biden administration's assessment, what do you expect the next 24 or 48 hours to look like? obviously, hard to tell given it's not even clear exactly what the extra teenage ing objectives are. >> given the indicators are pushing the putin plan to place the government in kyiv, we are not seeing what is happenening behind the scenes in the gray of intelligence and i can assure you right now russian intelligence -- meaning, mainly"
"1995",1995,"Anderson Cooper 360","April 15, 2022","Comcast Cable",">> we got her out! >> yeah. >> reporter: lydia greets cameraman scottie mcwindy. it is our old friend, she says. i'm so glad to see you again. after we left lydia thursday, there was an outpouring from people who wanted to help. we managed to connect volunteers to a care home in the relative safety of dnipro. leaving lydia alone in her apartment was incredibly tough. to see her safe is a huge relief. today i will finally feel calm, she says. this is so important. thank you."
"2028",2028,"Anderson Cooper 360","October 7, 2022","Comcast Cable","people with weakened immune systems may have a lower vaccine response. this flu season, you do have a choice. choose the protection of a sanofi flu vaccine. ask your pharmacist or doctor which sanofi flu vaccine is right for you. u won't take a time-out. one dose of ubrelvy quickly stops migraine in its tracks within 2 hours. do not take with strong cyp3a4 inhibitors. most common side effects were nausea and tiredness. ask about ubrelvy, the anytime, anywhere migraine medicine. before & bath fitter. now's the time to call bath fitter to get a beautiful ""after."" with our unique tub over tub process, there's no mess or stress. bath fitter. it just fits. visit bathfitter.com to book your free consultation. ♪ ♪"
"2039",2039,"Anderson Cooper 360","April 18, 2022","Comcast Cable",">> reporter: now, what was especially jarring was the kindness and the generosity they experienced in russia. the country responsible for bombing their homes and uprooting their lives. evgeni said he was so struck by the kindness, he went to church to pray for the people that helped me them. they say this is proof there are good people in every country, including russia.   ""ac 360"" starts now.   good evening. two breaking news stories we're closely following. in ukraine president zelenskyy says a major new russian offensive has begun in the east of the country. we'll have multiple reports from ukraine tonight of what will likely be a new and bloody phase of the invasion. now, the other breaking story is here in the united states. a federal judge has struck down the federal mask mandate for air and other travel, calling it unlawful. according to an administration official, that means the cdc's"
"2040",2040,"Anderson Cooper 360","April 18, 2022","Comcast Cable","in a new facility. tomorrow those men and women of that -- will be cooking. the ukrainian people are fighters. they -- we're here for our people and we'll keep fighting this war in the only way we know, which is feeding people. we are food fighters. >> it's amazing that they are going back to continue the work. did you ever think -- look, you worked all over the world and you worked in ukraine now for a while since the beginning of this thing. did you ever think something like this could happen? that a restaurant you partner with would be hit? >> i mean, understanding the moment we came to ukraine, we knew that something like this could happen. i mean, we need to understand one thing. we have more than 400 restaurant partners all across the ukrainian operation. many of them are inside ukraine. we are in more than 80 cities. we are delivering food in more"
"2105",2105,"Anderson Cooper 360","May 11, 2022","Comcast Cable","liberated a number of towns near kharkiv. the region where they reported the civilian killed has seen several explosions. the cause is missiles and bombs. ukraine has not confirmed nor denied responsibility for the blast. another major development is finland joining nato possibly. they agreed to assist each other militarily should either country face attack. finland shares an 800 mile border with russia. finland's president will contact vladimir putin if that should happen. >> if that will be the case, what my response would be that you caused this. vladimir putin's profile. critics made a daring escape from russia. she'll tell us how she managed"
"2122",2122,"Anderson Cooper 360","March 1, 2022","English","intervene with our freedom, and believe you me. >> zelenskyy went on to talk about the lives lost, children killed by putin's air strikes. and when he finished, a standing ovation. as so many around this world we live in are so deeply moved by what is unfolding in ukraine. our special coverage of president biden's state of the union address begins now with anderson cooper and jake tapper.   this is cnn breaking news. >> these are live pictures from the ukrainian capital where new explosions were heard tonight. the city bracing for an all-out assault by russian forces. vladimir putin's brutal war is intensifying at this hour as president biden is about to deliver his first state of the union address. i'm anderson cooper coming to you tonight from lviv in western ukraine for this special edition of ""ac 360."" there is grave concern across this country and in the region"
"2142",2142,"Anderson Cooper 360","February 28, 2022","Comcast Cable","though ukrainian president zelenskyy sounded pessimistic before the talks began. >> translator: i don't really believe in the result of this meeting, but let them try so then later on no citizen of ukraine would have any doubt that i, the president, did not try to stop the war when i had a chance. >> reporter: today the u.s. made a different kind of move on the diplomatic front, expelling 12 russian diplomats prosecute u.n., accusing them of espionage activities but noting this process has been going on for several months. cnn reached out to the state department for comment. military aid is still pouring into ukraine. the biden administration approving another $350 million of security assistance over the weekend, and even sweden, a non-nato member announced they would be sending 5,000 anti-tank weapons, 5,000 helmets, 5,000 body shields and 135,000 field rations. >> we're going to continue to provide security assistance to"
"2170",2170,"Anderson Cooper 360","May 23, 2022","Comcast Cable","confirmed cases, others under investigation. here in the u.s., new cases investigated in florida, utah and new york come just days after the virus first confirmed in massachusetts, telling news that cases are going to rise in the coming days. ac 360 starts now.   good evening, we begin tonight with the facts, sometimes politicians even within the statement party cannot stand one another, probably more common than you imagine but because most do such a good job of keeping personals quiet, we never see it on display, never in the way we see today, a former president broke out with former vice-president and lashed out at him in a way that is without modern precedent, ahead of georgia's republican primary, governor who"
"2180",2180,"Anderson Cooper 360","February 8, 2022","Comcast Cable","it senses your movements and automatically adjusts to relieve pressure points. and it's temperature balancing so you both sleep just right. and now, save 50% on the sleep number 360 limited edition smart bed. plus, 0% interest for 24 months. only for a limited time."
"2192",2192,"Anderson Cooper 360","July 25, 2022","Comcast Cable","runs, that that won't have an impact on whether or not he, mike pence, decides to run. having said that, you just saw what harry laid out very clearly when it comes to where the republican party is and more specifically where the former president is and how his approval ratings continue to go down, especially since what we have seen with the january 6 hearings. it's -- what i am told is that when you look at even some internal numbers for the former president, the thing that is most striking is that women in particular have fled, that he is doing -- donald trump is doing so poorly with women and that that has contributed to the unfavorable rating that you're seeing clicking up that harry just talked about. how that will be determinative not just if mike pence runs, but more importantly if donald trump"
"2193",2193,"Anderson Cooper 360","October 7, 2022","Comcast Cable","least a little of both. first shimon revealed that the school district police department had hired a former state trooper under investigation for corrections during the massacre. i should say lack of actions during the massacre. and shimon unveiled this video of her outside the school on th day of the massacre, talking to other officers. listen. >> an officer asked if her children attend robb elementary and lozano's response: >> yeah, my son is in daycare. he's not old enough. no, is my son had been in there i would not have been outside, promise you that. she said if her son had been inside the school, local i woul not have been outside him i promise you that."" so last night we learned that that officer has been fired by th e school district to be fired the day after shimon try to get answers about why she been hire in the first place, given she was under investigation by the"
"2194",2194,"Anderson Cooper 360","October 7, 2022","Comcast Cable","capitals, and reasonably even some others, all trying to persuade houghton that this would again be a colossal mistake on top of what is already a disastrous mistake fo russia. the plan also set records this report that is the first time since the cuban missile crisis that had been director of the use of a weapon. how does the threat and the situation compared to the 16 years ago? >> well, i think there is a lot of debate about thatat, anderso whether this is true as close t it. that was a nuclear armageddon i the making. and lots and lots of discussion by the so-called wisdom armageddon about that particula episode, endless stories on it, particularly influential unless by graham allison and hundred and so forth. i don't know that you can equat this to that. but that doesn't matter. this is a very serious moment. is a very dangerous moment. and it is one of the"
"2195",2195,"Anderson Cooper 360","October 11, 2022","","good evening. tonight, the justice department's message to the supreme court, stay out of mar-a-lago documents case. ever since the fbi got a warrant, they've conducted a -- search, finding boxes of documents, including highly classified ones that did not"
"2235",2235,"Anderson Cooper 360","February 15, 2022","English","verify but to just see. it doesn't take verification. both satellite imagery and high flying aircraft would be able to pinpoint the movement and where these forces are going. and certainly, that intelligence feed has made its way to the president after the various members of putin's cabinet said this morning that they were going to start pulling back. they're not pulling back based on intelligence. they may be repositioning, but are they repositioning from their motor pools to attack positions? are they repositioning to where they should be, if they're pulling back, and that's from motor pools to rail heads, to travel back into russia? that latter is not happening. they're still in the area and preparing the potential for attack. >> this is a knowable thing and i imagine the next 24 hours will be crucial to determining the posture there. how about president biden's new numbers, saying 150,000 russian troops are now encircling"
"2239",2239,"Anderson Cooper 360","March 4, 2022","Comcast Cable","have completely different standards when it comes to respect for human life. that should come as no surprise to anyone who has seen russia operate in places like aleppo and syria, according to the office and high commissioner for human rights it is recorded at least 331 recorded civilian mortalities so far with 700 wounded, throse mortalities caused by the tactics this senior intelligence official is warning about. then again, as we saw last night, the war continues. these forces risk poisoning a chunk of the continent by assaulting europe's largest nuclear power station in southern ukraine. tonight, video and sound from inside the plant as it came under fire and someone got on the p.a. system to plead for the shooting to stop. >> he's saying stop shooting immediately, you threaten the security of the whole world."
"2240",2240,"Anderson Cooper 360","April 14, 2022","Comcast Cable","artists rendering of the scene on instagram, changed to blue in honor of the ukrainian flag. olivia told ""outfront"" she sees it as a symbol of hope. >> i believe there is hope for the future, for ukraine, and that is why the girl in the blue dress became a symbol of hope for me. we must stand with ukraine, with ukraine's people and remember about second world war, what was happening. we can not let this happen again. >> growing up to do great things, thanks so much for joining us, ""ac 360"" starts now.   eastern ukraine braces for impact as russia's new offensive gears up and ukrainians celebrate as the flagship of russia black sea fleet goes"
"2241",2241,"Anderson Cooper 360","April 14, 2022","Comcast Cable","go with an open heart, and you will find inspiration anew. viking. exploring the world in comfort."
