"","X","Name","Date","Source","Text"
"79",79,"Anderson Cooper 360","March 14, 2022","Comcast Cable","war, do not believe propaganda, at the tell you lies here."" the woman who works for that channel was detained by police and left a video explaining her motives. [ speaking foreign language ]"
"81",81,"Anderson Cooper 360","April 29, 2022","","so i can't talk to his psychology, but i think we can all speak to his depravity. >> a whole lot in the hour ahead. reporting for us from washington, cnn's alex marquardt on the william cancel story, matt rivers and in the moldova capitol. >> reporter: the administration has not confirmed the death of william cancel, most of what we're learning coming from his mother. president biden did acknowledge cancel today saying it's very sad that he left a baby behind. what we do know from the cancel family is he was 22 years old, former marine. he felt this call to go and join the fight in ukraine. he had a wife, he left behind a 7-month-old child, had been working in tennessee as a corrections officer but his mother also says he joined a"
"104",104,"Anderson Cooper 360","April 27, 2022","Comcast Cable","perhaps something we needed to be reminded, which was this can happen anywhere. human beings can be brutal and venal and murderous and barbaric. you know, there's a sense in which, as you know, a lot of people outside the west ask, why are you so surprised? this has been happening in yemen or syria or places or afghanistan? well, the reason is europe was really founded on the idea that it was -- it had overcome these pathologies, you know, this murderous past. and, you know, it went through the worst of it in world war ii. and then we were reminded that uk have a very advanced, very civi civilized country -- so-called civilized country like germany -- which in many ways led the world in science and industry. and murderous acts. well, we're seeing it again. russia is a modern country. it's a relatively wealthy country."
"112",112,"Anderson Cooper 360","May 6, 2022","Comcast Cable","64 injured at the iconic hotel in havana cuba. a gas leak is expected to cause the massive explosion. it's a beautiful hotel. i stayed there when i covered president obama's historic visit in 2016. the hotel housed top officials and celebrities. it's an incredible tragedy and rescue crews are looking for survivors in the rubble this hour. thanks for joining us. ac 360 starts now.   we begin with a war and what the russians call liberation in a beautiful city called mariupol. russia says they have liberated it. this is what their liberation look likes. after more than 70 days of mis missiles, artillery, tanks, cutting off food and medicine from being sent in and stopping"
"139",139,"Anderson Cooper 360","March 16, 2022","Comcast Cable","return shen authorities. >> it is sick ening. >> will it change what the president is willing to provide the ukrainians? >> reporter: it doesn't seem like it because he labeled it at that for the first time after he laid out what a cities stance the u.s. will give to ukraine in the form of that $800 million today signing it in front of us that came hours after zelenskyy spoke calling for a no-fly zone. though zelenskyy seemed to indicate he understands it is not something they are going to get, certainly from the united states prompt positions there, but president biden saying vladimir putin is a war criminal is a shift from where he was. two weeks ago he said it was too early to say if he committed war crimes but things like what we saw with this bombing of the theater where people were sheltering and bombing of ma"
"142",142,"Anderson Cooper 360","March 2, 2022","Comcast Cable","have done nothing wrong. they are innocent, and they are now the victims of this war of choice by vladimir putin. that's the part that seems so unfair for all of them. >> well, international humanitarian law is very clear. it's the rules that govern conflicts and wars. civilians, essential infrastructures that are critical for their survival, i'm speaking medical facilities but also water companies, electricity companies, et cetera, must be safeguarded under international humanitarian law, and this applies to all parties concerned by what's going on right now in ukraine. >> they're the rules. i guess they just have to be followed by all sides, and we'll see what happens. thank you so much for being with us. please stay safe and thank you for what you're doing. >> thank you.   still to come, the massive russian military convoy heading to kyiv appears to have stalled. what the pentagon says could be"
"160",160,"Anderson Cooper 360","February 11, 2022","Comcast Cable","on the one hand there's dynamic still at play. >> a little more than a week ago the white house changed its wording of the russian invasion threat no longer using the word ""imminent."" so why are they now characterizing it so strongly again? yeah, that's right. earlier this month prospress secretary jen psaki took the podium and she said, look, we're not going to use the word imminent anymore because we don't want to wrongly suggest that we know whether putin has made a decision on whether to invade ukraine or not. to be clear what jake sullivan said today is actually the same thing he said on that point, that they still don't know whether putin has made a decision. but clearly the information tr they're trying to present today is one of increased urgency. one on the time line. now the intelligence is this kind of invasion could actually happen before the olympic games"
"178",178,"Anderson Cooper 360","January 18, 2022","Comcast Cable","attorney for kimberly guilfoyle who told us the subpoena is, quote, of no consequence to her because she has absolutely nothing to hide or to be concerned about. for the record, anderson, the committee declined to comment on the subpoenas. >> so, in your reporting, do you know why the committee's interested in kimberly guilfoyle and eric trump's phone records? >> so, we don't know yet. but it's my understanding the committee has made it a practice when it comes to issuing subpoenas, it's for a very specific reason. these are not just blanket requests for records. so as an example, there is no evidence that the committee reached out for call records for trump's other children, don jr., ivanka, or his son-in-law jared kushner. and just for context, i want to explain a call detail record -- we reported on this in the fall -- or a cdr. this gives the committee a phone log of the date, time, and length of incoming and outgoing calls."
"217",217,"Anderson Cooper 360","March 2, 2022","Comcast Cable","ukrainian civilians are confirmed dead, though the real toll is likely much higher. at one point more than 2,000 civilians were said to have been killed but later backtracked on that. the russian military denies targeting civilians and says designated evacuation corridors have been mapped out. russia's increasingly fierce attacks continue to be met with a brave, determined ukrainian resi resistance. many now wonder how much longer can the ukrainians hold out against the full might of the russian military. >> reporter: russia's assault on ukraine continues without mercy. this is what's left of a university in kharkiv, the country's second city, amid a pounding of civilian areas. in the port city of mariupol"
"237",237,"Anderson Cooper 360","March 9, 2022","Comcast Cable","live that long, of course. so, i don't want to leave, and we will be moving to somewhere just further away from russian border. i don't know why, but being bombarded is easier than leaving your home. >> family tonight part of what the u.n. estimates are 1.8 million internally displaced people within ukraine. that's on top of the 2 million people who have already left ukraine and become refugees. more now on how some of those internally displaced people spent today from cnn's matthew chance. >> reporter: in the chaos of this evacuation, the frantic search for a lost child. in the rush to escape the fighting, an orphan has been left behind. each bus desperaticely checked r"
"263",263,"Anderson Cooper 360","April 27, 2022","Comcast Cable",">> there are lives here that you can see russia has changed forever but also those whose traumas sit beneath the surface lives on. >> nick is joining us now. it is a horrible story, i know you reached out the military defense about this is allegation, what did they say? >> reporter: they have not responded. in the past, they suggested such claims are patterns trying to paint russian force in a bad light. the systematic nature of so many of the claims we have been hearing are similar to suggest that, the conversations we had with ukrainian officers, of victims' testimonies have"
"296",296,"Anderson Cooper 360","March 2, 2022","Comcast Cable","zelenskyy releasing a message from there saying more and more occupiers fleeing back to russia, from you, for all that drive out the enemy with javelins and helicopters, everything that shoots. i wish you help, ukrainians, strong and kind but not to the enemy. what has become now daily post from the ukrainian president who is standing so firmly. thanks for joining us. ""ac 360"" starts right now.   day eight of russia's war in ukraine, it's about to dawn on a country that has already been severely tested. the latest a few moments ago with two new large explosions heard in kyiv. so it begins again. tonight. yet no matter what russia drops on them or tries to take from them, ukrainians simply refuse to give an inch. that does not go -- that goes not just for men and women in it uniform, but also for ordinary people doing the extraordinary."
"297",297,"Anderson Cooper 360","March 2, 2022","Comcast Cable","so the spirit of people is not going down. it's going more up and up because we see in the news all this brave cases when people just stop with a tractor which they are own hands. and there were thousands of people that just stand in the road and meet the russian troops. and there is a sense of humor to help ukrainians to be strong. so the spirit is up. and today i saw that almost 90% of the ukrainians are sure that they will win. putin thought if he would bomb the second biggest town of ukraine like destroy it completely and the other towns he would damage a lot. maybe people would be afraid and surrender. but what he did, people feel like now we have nothing to"
"311",311,"Anderson Cooper 360","February 28, 2022","Comcast Cable",">> announcer: this is cnn breaking news.   welcome to our viewers joining us in the united states and all around the world. i'm michael holmes coming to you live from lviv in ukraine as this country faces day six of a russian invasion.   and a massive russian convoy bearing down on the ukrainian capital, kyiv. satellite imagery showing it stretches for more than 40 miles, or 65 kilometers, and includes tanks and artillery. russian troops have breached the kyiv suburbs before and met fierce resistance."
"312",312,"Anderson Cooper 360","March 18, 2022","English","to that facility itself. again, they lose the fight on the ground and respond with this extraordinary level of blunt force often from long-range missiles. i think that's concerning, anderson, going forward. and if we are going to see russia essentially losing the fight for towns here, it chooses sort of scorched-earth policy of slamming those towns, military facilities, civilian facilities you can see there too in sam's report with extraordinary firepower. >> kaitlan, what did president biden say about his call with president xi? >> he said it went well. i ran into him in the halls of the west wing after he had spoken to chinese president xi jinping for about two hours today. that is the first time they talked since russia started conducting this invasion. it is the first time they talked really in four months so obviously there was a lot to discuss. but really, what officials said they wanted to get to the heart of was president biden wanted to find out if president xi plans to follow through and grant this request that russia has made for"
"319",319,"Anderson Cooper 360","April 11, 2022","Comcast Cable","devastation right here is the crater from where a bomb was dropped just two days ago. north of here about 25 miles away is inside russia. that's where the russian positions are shelling. that's where they're throwing devastation and death into places like this in kharkiv into civilian areas. most of the people who have been able to evacuate have already left the city. those that remain have told us it's because they believe that nowhere in ukraine is safe. they wouldn't speak on camera because they're worried what will happen when and if the russians finally arrive, and that is what u.s. and ukrainian intelligence officials believe is about to happen. they believe that russian troops are amassing. that was just a mortar strike as we were talking. it's about the third or fourth that we've heard. it's coming from that direction over there. we're continuing to hear"
"329",329,"Anderson Cooper 360","March 6, 2022","Comcast Cable","weekend including at a check point for evacuating civilians in the suburb where the mayor says a family, two parents and two children were killed. four other people died in other strikes across the district the mayor said. just over 50 miles from kyiv nearly 20 residential buildings rocked by russian fire. it's not clear how many were killed or hurt. >> russian plagues continue to bomb ukrainian civilians including women and children. it's a disaster here. >> reporter: in the village, just south of the capital, russian air strikes killed a number of civilians including a disabled 12-year-old girl, her father said -- >> [speaking foreign language]."
"332",332,"Anderson Cooper 360","April 28, 2022","Comcast Cable","ukraine foreign minister says the attack happened with un secretary general still in the capitol. earlier in the day the secretary general visited bucha and -- both sites of widespread atrocities during the russian occupation. tonight ukraine president zelenskyy said investigators have already identified ten russian servicemen as suspects in connection with with killings in bucha. president zelenskyy said their names are known and about to find them and anyone else responsible for atrocities in the invasion. the war goes on. american defense officials say russian and/or those forces made some progress in the east and signs they are getting somewhat better at certain operational and logistics scales. western officials familiar with the latest intelligence say it's not clear moscow will be able to implement changes needed to dominate there. they are however trying to impose whatever political and economic control they can in places that they do occupy. a newly installed russia friendly official said they will use the ruble as the official"
"376",376,"Anderson Cooper 360","February 24, 2022","Comcast Cable","calm. the only places we saw groups of people were atm lines, every single atm. some ran out of money although we did see some still had money early this evening. then there were gas lines. this one was outside the city. we did see a few stations ran out, but the lines were incredibly calm. i spoke to some people and one woman told me as her voice broke she had a plan to leave for poland when the unimaginable happened, but when it did she decided to stay. there's so much we don't know tonight, but we do know the people we have met here over the past cup of weeks have all had an incredible reservoir of strength. thank you for joining us. ac 360 starts now.   good evening. ukraine tonight bracing for what the coming hours might bring. already it's seen russian forces attack on three fronts with concerns now growing what an"
"390",390,"Anderson Cooper 360","March 17, 2022","Comcast Cable",""
"391",391,"Anderson Cooper 360","March 17, 2022","Comcast Cable","earlier i spoke with samantha power, current head of the u.s. agency for international development. she talked about the extreme difficulty of getting refugees out, and that if you live in one of the besieged areas, it's excruciating. little food, water, or medicine. even, she said, reports of dehydration deaths, which we've heard about in the city of mariupol. miguel marquez met some of the fortunate ukrainians who were able to escape and are now experiencing life in a romanian city who opened their arms to them. >> reporter: who are all these people? friends, fellow citizens, and colleagues, she says, family too, all from donbas in,"
"399",399,"Anderson Cooper 360","September 26, 2022","Comcast Cable","so it's significant to say the least. >> yeah, ten feet of water right on top of where people live. which could be lethal. tom, thank you so much for that. we're going to watch this storm throughout the hour. we'll bring you a live report from cuba that tom just mentioned later.   now we have multiple new developments with less than two days to go until wednesday's house january 6th committee hearing. there are the text messages obtained by cnn connecting then white house chief of staff mark meadows with a key player in the scheme to seize voting machines. there is also new footage in the former president's long time alloy roger stone, a day before the 2020 election saying, ""f the voting. let's get right to the violence."" cnn's sarah murray has more on both stories and joins us now. so, sarah, let's start with this documentary footage of roger stone. >> he said this is a day before the 2020 election. roger stone is, of course, a long time key ally of the former president. he pretty much makes it clear in this footage, you know, shot by documentary filmmakers, he"
"421",421,"Anderson Cooper 360","March 29, 2022","Comcast Cable","and so it seems that that is what they're trying to say in russia, that from certain areas they will whatever you want to call it, and redirect to eastern ukraine, which they have talked about. that's what they say they want, which obviously is where they already occupy at least parts of it, and presumably they want it connected with the south which is why they're bombing the heck out of mariupol, 160,000 people still there, so many people under so much stress, and without any kind of humanitarian aid. so we wait to see. there have been some positive signals. there's no doubt that what happened in istanbul is potentially the most positive, at least by both sides' account, since these talks began. >> for weeks though, we have been hearing occasional positive statements from president zelenskyy about there may be some movement in talks. how realistic do you think these talks are between russia and ukraine? because there are certainly major challenges still to work out. >> there are huge challenges,"
"493",493,"Anderson Cooper 360","March 18, 2022","Comcast Cable","person's estimate. it is not a fact. this is only part of a picture that includes a number of notable injuries though at a cost of russian forces on the ground and significant russian casualties. for more on this, i'm joined by cnn's fred politen. >> i think one of the interesting things we're seeing on this evening is that it's happening in several locations. first and foremost, the ukrainians are telling kyiv, for instance, they believe they've halted the russians there, pushing them back in certain areas chls also mykolaiv they believe they're making headway also. also in places in the north like kharkiv where they were having a lot of trouble, the ukrainians think they're making significant headway and causing damage to the russians. >> reporter: another blow to vladimir putin's military. ukrainian forces claiming they ambushed this convoy of russian"
"515",515,"Anderson Cooper 360","May 9, 2022","Comcast Cable","your mission: stand up to moderate to severe rheumatoid arthritis. and take. it. on... ...with rinvoq. rinvoq a once-daily pill can dramatically improve symptoms... rinvoq helps tame pain, stiffness, swelling. and for some...rinvoq can even significantly reduce ra fatigue. that's rinvoq relief. with ra, your overactive immune system attacks your joints. rinvoq regulates it to help stop the attack. rinvoq can lower your ability to fight infections, including tb. serious infections and blood clots, some fatal; cancers, including lymphoma and skin cancer; death, heart attack, stroke, and tears in the stomach or intestines occurred. people 50 and older with at least one heart disease risk factor have higher risks. don't take if allergic to rinvoq as serious reactions can occur."
"527",527,"Anderson Cooper 360","March 13, 2022","Comcast Cable","dire over a week ago. it's only gotten worse every day since. at this point, we were saying it was going to be a disaster. the disaster is now unfolding in front of us. we already know from our staff we've communicated with that vulnerable groups such as people with chronic conditions who needed access to medical care have already started to die. we know that there have been numerous deaths due to the violence and bombing in the city. our staff has also informed us they've seen neighbors digging holes in their own backyards to bury bodies of their neighbors. this is an absolute nightmare. and we know that water and food are running out, or for many of the population, have already run out for several days. so we will now start seeing people dying of hunger and dehydration if something isn't done immediately. >> i know president zelenskyy had said a child days ago had"
"553",553,"Anderson Cooper 360","September 23, 2022","Comcast Cable","good evening. we begin tonight with a large part of florida under a state of emergency. the storm system that does not even have a name yet but is heading straight at florida and could be a major hurricane if and when it arrives. jennifer gray is tracking this storm at the moment known only as tropical depression 9. she joins us. when, jennifer, can florida expect to start to feel the effects of this? >> well, they'll start to feel the impact as early as monday night into tuesday if you're in the keys, but then it's going to basically parallel the coast"
"554",554,"Anderson Cooper 360","September 23, 2022","Comcast Cable","some of the most important cases on the court, abortion, guns, the power of the epa to regulate the climate. you were on the losing side. was that frustrating for you to lose important case after important case? >> yes. >> how frustrating? >> very frustrating. >> when the court undoes a right that people have lived with for half a century doesn't that very much shake the authority of the court? >> did i like the lou daubs decision, of course i didn't. was i happy about it? not for an instant. did i do what i could to persuade people, of course. of course. but there we are, and now we go on and we work to get daub on. it's a little corny what i think but i do think it."
"616",616,"Anderson Cooper 360","February 23, 2022","Comcast Cable","three airports. as we mention cyber attacks are already under way. culprits not officially known yet. key ukrainian government websites are now down. and the ukrainian defense ministry is reporting dozens more cease-fire in the break away regions with russian leaders saying the leaders of the two russian backed so-called republics are asking moskow for military assistance against what they describe as ukrainian aggression. with all that and more unfolding we learned a few moments ago the u.n. security council is going to hold an emergency meeting scheduled for 9:30 eastern time tonight. that's about an hour and a half from now. we're bringing all of it to you. kaitlan collins at the white house, cnn's jim sciutto in ukraine. kaitlan, let's start with you. what is the white house saying about the apparent change in tone from ukrainian president zelenskyy? >> they're watching it very closely because of course this is a white house that has often had to balance ukrainian"
"620",620,"Anderson Cooper 360","April 20, 2022","","bargain but continued shelling and ignored the cease-fire. so that opportunity to get civilians out of there was not taken. we're also talking evacuation of soldiers at one point. i spoke to that gentleman in that piece and said would soldiers ever give up and surrender to the russians in that battalion we spoke about, and he said, no. he said because they firmly believe the russians hate them so much if they were to surrender, anderson, they'd be summarily executed by the russians. he said for those soldiers there's two ways out of mariupol. either they get evacuated safely by a third paerty country or di there fighting. >> i'm wondering what things like for russian troops now because a lot of them have moved from positions far in the north. they've come down now to fight in the east. you know, are there supply lines open? do we know much about things for"
"626",626,"Anderson Cooper 360","March 17, 2022","Comcast Cable","cannabis oil in her luggage. she has been denied access to her legal team. nobody knows exactly where she is. no one's been in contact with her. this continues for months on end. thanks so much for joining us. ac 360 starts now.   it is hard to say good evening from ukraine even on the best of nights, and harder still given what we have seen cities and towns across ukraine today. we're going to get in the two hours ahead to all of the latest developments in kyiv, kharkiv, mariupol. we're going to talk with our reporters, our analysts, those living through this horror, but before all of that. we don't know his name or the name of his mom whom he's"
