"","X","Name","Date","Source","Text"
"2263",2263,"Anderson Cooper 360","June 15, 2022","Comcast Cable","[ music stops ] [ beeping ] cars built with safety in mind, even for those guys. the volkswagen atlas with standard front assist. ♪ ♪"
"2265",2265,"Anderson Cooper 360","September 27, 2022","Comcast Cable","often do, and that they were waiting to turn the power back on to make sure there aren't any fires or people that get electrocuted by downed power lines. of course, the electrical system had problems for months here. that's led to rare protests, people taking to the streets, because they're so angry over these frequent blackouts. so from havana west, this island is without power. and we are hearing more reports of cities and towns without power. so why is the power down so many hours after the storm passed through here and how long will it take the government to put it back on? certainly western cuba, very hard hit. hundreds of people, thousands have lost their roofs, have had trees down in front of their houses. people just beginning to return to their towns to see the destruction there. and it will be a process of days, if not weeks to begin the"
"2302",2302,"Anderson Cooper 360","October 7, 2022","Comcast Cable","♪ our dell technologies advisors provide you with the tools and expertise you need to do incredible things. because we believe there's an innovator in all of us. new astepro allergy. now available without a prescription. astepro is the first and only 24-hour steroid free spray. while other allergy sprays take hours astepro starts working in 30 minutes. so you can... astepro and go."
"2321",2321,"Anderson Cooper 360","April 12, 2022","Comcast Cable","they run the same risks. >> thank you so much for coming on and speaking out for your husband, when in this moment he cannot do it for himself. i really appreciate it. >> thank you very much for having me here. >> thank you. >> and thank you all so much for being with us tonight. i'm kate bolduan. ""ac 360"" starts now. >> police in new york tonight now have a person of interest. their words, in the subway mass shooting this morning that might have easily become a massacre. 33 shots fired, 10 people wounded, amazingly and thankfully, no one killed. john berman here in for anderson, and take a look at this. these are the photos the nypd released of frank james, the person of interest. he's 62 years old, he has addresses in wisconsin and philadelphia, and we should stress, police are not calling him a suspect. they say he rented a van, found"
"2345",2345,"Anderson Cooper 360","March 25, 2022","Comcast Cable","trying to decide whether it's worth questioning the supreme court justice's wife. a pretty amazing moment we're in where this is even under consideration, but there are 29, 28 more text messages where the one i just shared came from. thank you so much for joining us, you can watch ""outfront"" anytime on cnn go, ac 360 starts now.   good evening, there are potential signs tonight of what could be a change in russian after aims in ukraine, even as the definite signs of trouble for russian forces on the ground are piling up. remember, a day ago, russia's foreign ministry said the war was going according to plan, well today a top russian general shifted focus away from that plan which, by the way was vladimir putin's stated plan toward more limited goals. the question now, is he moving the goal post? we'll ask our correspondents and military analysts in the two hours ahead. first, though, new video from inside the theater in mariupol that russian forces hit, the"
"2346",2346,"Anderson Cooper 360","March 25, 2022","Comcast Cable","peace, like in famous orwell novel, it's something we've been witnessing for the last some 30 years, and, you know, definitely as strong as to date, witnessing it since 2014 and it just hurts me to see that president putin, his regime, his power is agonizing, hurting so many people including my friend who was just murdered in kyiv. >> i want to ask you about her, because you mentioned her oxanna bolina was her name, killed in a shelling incident while working in kyiv, i want to show our viewers, tweet yesterday said 2017, alalexei nava all, ny still has freedom, those who laugh, love, those who fight and know to never be scared."
"2354",2354,"Anderson Cooper 360","January 14, 2022","Comcast Cable","a bloody -- a massively bloody revolution against them. that's what's going to have to happen. we asked about all that. his supporters say that's simply overblown, that it was just rhetoric. but his ex-wife spoke -- stewart rhodes' ex-wife spoke with cnn today and she described him as a sociopath -- someone who is a dangerous man. very much, interested in creating a mythology of being a great leader around himself. anderson. >> interesting. ed lavandera, appreciate it. more now on who the defendant is, how his group came to be, and what more mr. rhodes, himself, openly said he had in mind for washington. cnn's drew griffin as that. >> oath keeper, leader, and founderings stuart rhodes spent nearly a year publicly denying he had anything to do with the violence on january 6th. >> there were no plans by the leadership -- us -- to enter the capitol. no instructions by us to do so. we didn't even know that any of our guys had done it, until afterwards. >> reporter: but this indictment"
"2359",2359,"Anderson Cooper 360","September 30, 2022","Comcast Cable","seeing that. kevin, if you can hear me, thank you for joining us. i am glad you are safe. i'm so glad that you're safe. >> thank you. >> tell us what happened when the storm hit. what did you do? >> well, you know, they were forecasting it. they were warning everybody this could be, you know, the worst storm ever, and it was supposed to go toward tampa, then they talked about the storm surge being 18 feet, you know, and i think a lot of people got caught off-guard because storm surge -- well, first of all we didn't even get the eye. we got the worst end of it, and it just came on. and the storm surge kept coming, and it got up to 25 feet high. i saw it all happen. houses are floating in the back bay. people are on their roofs. there's a lot of lives lost here. this island, i couldn't even find my street where i live."
"2412",2412,"Anderson Cooper 360","May 4, 2022","Comcast Cable","children, but i could not imagine going through that again. after discussions with my partner, who was completely supportive of whatever choice i made, i decided to have an abortion. for me, terminating my pregnancy was not an easy choice. the most difficult i've made in my life. but it was my choice. and that is what must be preserved for every pregnant person. >> just before air tonight, i spoke with congresswoman jayapal about the supreme court's decision as well as her own decision to share her story. congresswoman, thanks so much for joining us. i know this is obviously deeply personal for you. i'm wondering how your own experience shaped your view of abortion rights being in jeopardy right now? >> well, anderson, i have always been a supporter of abortion rights. but when i had to go through the experience itself it gave me a whole different perspective on the nuances and the complexities of making a decision like this and also the incredible importance of having it be for nobody to make except the"
"2413",2413,"Anderson Cooper 360","May 4, 2022","Comcast Cable","particularly in the senate, as radical because this is a policy that is removing a law that's been on the books for 50 years, and say, if you vote for this candidate, you are voting for radical policy. and here are the implications of that policy. so, you have to do both. you have to say, this is how we help you as voters but also this is how the republican party is going down a radical path that you may not be able to come back from for decades. and he says that's the way to kind of move on it. but you can't just do it here and there. you have to do it right in candidates' faces. >> gloria borger, david axelrod. go ahead, david. >> i think one of the things people are sensing right now, there's a sense of chaos out there right now. there's a sense that things are disorderly. >> right. >> this is a very, very upheaval -- this is a big upheaval right now. and i think connecting the"
"2417",2417,"Anderson Cooper 360","January 19, 2022","Comcast Cable","tonight, a president on the defensive tries to regain the initiative and a former president's battle to keep his white house documents away from the january 6th committee ends in defeat at the supreme court. that is in addition to the current president's voting legislation on the line but expected to fail just moments from now in the senate which is taking it up as we speak. so there is a lot of things at play right now and the president went into his part of it with his job approval number 13 points under water. more people disapproving by 13 points, 54% to 41% approving his -- his -- the job that he is doing. and cnn's latest poll of polls, it is a low outmatched in modern times only by the former president. the figure reflects his -- his decisions on covid, shortages, inflation, and more broadly speaking, it speaks to a question president biden was asked this evening when he spoke to reporters in the east room -- does he now, after a year on the job, think he overpromised on what he could accomplish when taking office? >> the fact of the matter is that we're in a situation where"
"2423",2423,"Anderson Cooper 360","March 3, 2022","Comcast Cable","serious this may be? >> well, good question. i wish i had a good answer. i would say that there's so many uncertaintied uncertainties surrounding it but if i were doing my check list, first, where is the fire? and secondly, who is in control of the powerplant? it was reported that russians had taken control because of the concern about these risks, what it is they're fighting that gave rise to the fire or, you know, how did this come about? and then thirdly, what about the people who are trying to manage, put out the fire, given particularly the difficulties at night and with the uncertainty around it. and if there's fighting going on around chernobyl, around the facility, which i can't tell from the information available then obviously having firefighters trying to fput outa"
"2425",2425,"Anderson Cooper 360","March 22, 2022","Comcast Cable","city. you're going to hear one of the soldiers who managed to get off three rpg rounds in quick succession shout allah akbar. the one who published this are chickeneck chechen fighters. cnn cannot emindependently confm this. with that in mind, here's the video. [ gunfire ]"
"2444",2444,"Anderson Cooper 360","March 15, 2022","English","moments of blinding grief. >> pieces left to wonder alone. >> that woman, her husband lying there still in a pool of blood. were you surprised what the ukrainians told you that the russian soldiers had said to them about being shot? if they go backwards, they go forward, but they don't really know what they're doing? >> some of it we have to say with a degree of skepticism the things we're told by one side about the other. and bear in mind the geneva convention about war. but it is interesting because it"
"2456",2456,"Anderson Cooper 360","July 25, 2022","Comcast Cable","a lot happening across the january 6 landscape includes tonight -- former vice president mike pence's general counsel greg jacob testified last week before federal grand jury. jacobin former pence chief of staff -- to highest ranking officials in the former ministration will have no known to have talked. one more piece in the larger picture dominated by the fact that more than 70 million viewers what should have been billed as this january 6 committee season finale, an interest have been high throughout. the question now is whether any of it has changed any minds, and more specifically, weather could change any votes in the midterms this fall in 2024. there is some answers. our one and only harry anton joins me. are you seeing any change in the former president now that the hearings concluded? >> one of the things i've learned covering president trump, and his electoral history, is the more he's in the news, the worse it is for him. take a look at his net favor"
"2462",2462,"Anderson Cooper 360","April 27, 2022","Comcast Cable","shrapnel could hurt us. we try to hide there, in the bomb shelter. two months of war has driven these people underground and there's no end in sight. the fears, alexander confesses, he tries to keep inside, but it crepes out. >> there's one more delivery that the police have got to o oe but every time we try to get out the front door of this building there's another impact. there's another one now. they're saying that the hospital, which is nearby, is under heavy shelling. we were planning to go there. we can't get through nor, indeed, at the moment can we even get out of this bunker. the hospital was hit. images done posted online by the local administration. they said one civilian killed, others injured and several"
"2492",2492,"Anderson Cooper 360","February 16, 2022","Comcast Cable","attacks, whether it be misinformation that are having an effect. and so they resent, i think it would be fair to say, this kind of exclusive focus on this idea of a full-scale invasion because they see so many different permutations of russian aggression they're dealing with on a daily basis. interesting to see while some of that intelligence lines up exactly with the u.s., how they're interpreting it appears to be quite different, john. >> indeed. jil, to you in moskow. secretary blinken today said that vladimir putin, quote, could pull the trigger but underscored the use continues to pursue diplomacy. he said the ball is in russia's court. what's the latest from the cellcell kremlin at this hour, and how's it being framed in russian media there? >> reporter: you know, i think there's a bit of deliberate confusion which sometimes can work in president putin's favor."
"2497",2497,"Anderson Cooper 360","February 16, 2022","Comcast Cable","cnn's cnn cla race a ward. kaitlan, the administration warns there is no sign of deescalation from moscow, with forces moving into fighting positions. what more can i tell us about these new troop numbers and this new bridge construction? >> well, john, yesterday, officials including president biden himself were skeptical of the russian claims that they were partially drawing down some of those troops they have amassed on ukraine's border. and now, today, they are outright saying it's not true. and not only are they not drawing down troops, they are adding troops by the thousands, putting that number -- about 7,000 above the 150,000 figure that president biden cited yesterday, which was already an increase in what u.s. officials had been saying. and so, they said they are adding these to the -- to the ukrainian border in recent days -- as recently as today, they saw some of these troops moving and so on those russian' claims, they are saying every indication we now have is that they mean to only publicly offer to talk, and make claims about deescalation, while privately, mobilizing for war. and john, it's not just that these numbers that we are seeing"
"2498",2498,"Anderson Cooper 360","February 16, 2022","Comcast Cable","what more can you tell us about that? >> so this is interesting, john, because essentially, ukrainian intelligence was, you know, roughly on the same page with the u.s., in terms of the number of troops at the time when cnn had access to reading this. this morning, it was 148,000 was the ukrainian estimate. this is before the -- the 7,000 that the u.s. has now said they believe are also present on that border. but their understanding of what those 148,000 troops would be capable of doing seems to dramatically differ from what the u.s. is saying. essentially, ukrainian intelligence sources, saying they do not believe that this would be enough for a large-scale invasion. now, it's important for our viewers to understand, john, that this has to be taken in the broader context of a general rift that we have really seen between the u.s. and ukraine. whereby, ukraine really wants to roll back the dialogue or rhetoric around this idea of a full-scale invasion. simply put, because it is having a destabilizing effect on the"
"2500",2500,"Anderson Cooper 360","January 27, 2022","Comcast Cable","there's plenty of people both on the left and the right who just don't believe the u.s. should be involved in these kind of, you know, on the international stage in this way if it's not perhaps directly affecting the united states. >> you're exactly right. and that schism within each party, particularly with the republican party, isn't new, but it has been much more profound since former president trump was the head of the party because that's what he ran on. he ran on america first. he ran on protectionism. he ran on -- against the last before him republican president, george w. bush, and the iraq war and sending u.s. troops into battle and into arenas all over the world. what is very different is the kind of thing that you just showed, that people like tucker carlson and what used to be the fringe of the gop in the house in particular used to say, which"
"2516",2516,"Anderson Cooper 360","August 24, 2022","Comcast Cable","reporting that a russian strike on a train station in eastern ukraine had taken at least 16 civilian lives. the death toll now stands at 22. but if the last six months have shown anything, it's that targeting civilians is not merely a regrettable accident of russia's war. it appears to be central to it. the video you're about to see is from early march. it was taken during the evacuation of irpin outside kyiv. a family, a mom, her two children and a friend helping them flee killed in a mortar attack. [ speaking non-english ] >> shit!"
"2517",2517,"Anderson Cooper 360","August 24, 2022","Comcast Cable","district have preferred a gunfight with officers in the hallway to break out again? it said that arredondo did everything right, that arredondo did everything that he was supposed to do to try and save the children inside that classroom, the children inside that school. and then, anderson, he talks about how he does not feel safe, how arredondo does not feel safe to come and face the school board, to defend himself. so that is why he had to write this 17-page statement saying that he's received death threats and that he can't carry his gun, and therefore there's no way for him to feel safe, and that is why he can't come to the school board and defend himself. so this was a letter that essentially he wrote defending himself, saying that he did nothing wrong, and basically saying that he wanted his job back. >> wow. >> reporter: it sort of lacks compassion. >> the answer to that attorney's question in that document is, yeah, that's exactly what he"
"2522",2522,"Anderson Cooper 360","September 15, 2022","Comcast Cable","and they also plan to move to other cities. in some respects, migrants are getting a ride here from these republican governors, and others are confused about where they are. the bottom line here, john, is that it is catching cities off-guard, and it does not allow them to prepare, and the lack of coordination is what officials are really criticizing here. >> priscilla alvarez for us in miami. we were in texas and on martha's vineyard as well. perspective now from former democratic congressman charlie crist who is not running against rhonda scent is florida governor. chris previously served for governor as florida as a republican. we also requested that governor desantis join us, and we never heard back. congressman, let me ask you, what is your reaction to all this, the migrants being flown apparently from texas to martha's vineyard? >> john, it's astounding to me. this is so cruel and so unnecessary, so uncalled for and so brazen. it shocks the conscience of any fair minded human being, that the governor"
"2554",2554,"Anderson Cooper 360","January 25, 2022","Comcast Cable","spoke with ukraine's foreign minister. what did he have to say? >> well, anderson, it's no secret that there has been some daylight between the u.s. and ukraine in terms of primarily really the messaging around the handling of this crisis. the foreign minister was very open about the fact he was annoyed at the u.s.'s decision to withdraw families of embassy personnel here. he felt that that was premature, that it was unnecessary, and there's a widespread concern that it contributes to a sense of panic. but for the most part, he really wanted to give the impression that the u.s. and ukraine are working in lockstep, and he was particularly pleased to hear the news that of those up to 8,500 u.s. troops who are on heightened alert and could potentially be deployed if need be, take a listen to what he said about that. >> i think it's a message to putin that, listen, whatever you're trying to achieve, you get the opposite. if you want us to withdraw from central europe, to withdraw nato"
"2555",2555,"Anderson Cooper 360","January 25, 2022","Comcast Cable","hey lily, i need a new wireless plan for my business, but all my employees need something different. oh, we can help with that. okay, imagine this. your mover, rob, he's on the scene and needs a plan with a mobile hotspot. we cut to downtown, your sales rep lisa has to send some files, like asap! so basically i can pick the right plan for each employee. yeah i should've just led with that. with at&t business. you can pick the best plan for each employee and get the best deals on every smart phone. ah, i can't. ah, my toes! ah, how much further? turns out, it is hard walking a mile in someone else's shoes. and it turns out the general is a quality insurance company that's been saving people money for nearly 60 years. i can't, i gotta go, ah let's trade back."
"2558",2558,"Anderson Cooper 360","October 11, 2022","Comcast Cable","good evening. tonight the justice department's message to the supreme court, stay out of mar-a-lago documents case. ever since the fbi got a warrant and conducted a court-approved search, finding boxes of documents, including highly classified ones that did not belong to him, the former president has been trying to slow or stop the wheels of justice from turning. which is his right, each about if it means taking it all the way to the supreme court, which he has. today was the deadline for the department of justice to make its case to the supreme court. we'll have details on their filing in a moment. but first, the former president has now also been making new false statements about other former presidents keeping classified documents. he previously claimed former president obama kept millions of documents for himself. now it's obama and bill clinton and george h.w. bush. >> george h.w. bush took millions and millions of document. to form a bowling alley feesed together what was then an old and broken chinese restaurant."
"2560",2560,"Anderson Cooper 360","February 15, 2022","English","you are not our enemy. and i do not believe you want a bloody, destructive war against ukraine, a country and a people with whom you share such deep ties of family, history, and culture. 77 years ago, our people fought and sacrificed side by side to end the worst war in history. world war ii was a war of necessity. but if russia attacks ukraine, it would be a war of choice, a war without cause or reason. >> the president there doing what every cold war president once did routinely and ronald reagan once did so well, trying to go around the man at the top and here trying to appeal for whatever it may be worth to putin's superpower pretensions while reminding him of the responsibilities that come with it. >> two paths are still open. for the sake of historic responsibility, russia and the united states share for global"
"2567",2567,"Anderson Cooper 360","June 15, 2022","","coolsculpting targets, freezes and eliminates treated fat for good. no needles, no incisions. discuss coolsculpting with your provider. some common side effects include temporary numbness, discomfort and swelling. you've come this far... coolsculpting takes you further. visit coolsculpting.com moderate to severe eczema still disrupts my skin. despite treatment it disrupts my skin with itch. it disrupts my skin with rash. but now, i can disrupt eczema with rinvoq. rinvoq is not a steroid, topical, or injection. it's one pill, once a day, that's effective without topical steroids. many taking rinvoq saw clear or almost-clear skin while some saw up to 100% clear skin. plus, they felt fast itch relief some as early as 1 week. that's rinvoq relief. rinvoq can lower your ability to fight infections, including tb. serious infections and blood clots, some fatal, cancers including lymphoma and skin cancer, death, heart attack, stroke, and tears in the stomach or intestines occurred. people 50 and older with at least one heart disease"
"2603",2603,"Anderson Cooper 360","October 10, 2022","Comcast Cable","and people who are driving to work, who were driving to school, taking their kids to school who had taken their kids to the dentist, which i planned to do but i had to drive a little bit later, thank god we were not riding at this time in this place. >> that was alana shortly after the attack. we spoke before air time tonight. alana, thank you so much for joining us. i'm so glad you and your family are safe. i know you're joining us from the basement of a building. can you talk about what's going on? what you've been seeing and hearing and where you are? >> well, i woke up in the morning. they said good morning and explosions followed. we heard them clearly even though they were in and out of the neighborhood. i was about to take my kids to"
